{
  "acceptance_tests": [
    "loads"
  ],
  "animation": {
    "clock": "integer_ticks"
  },
  "approved_by": "fixture",
  "camera": {
    "projection": "orthographic"
  },
  "content_hash": "fc7ae98d5a75c75c4d31fcebb041709d86eda04902b7367cf99bbc9593665af9",
  "format": "rpg-world-forge.visual_bible",
  "format_version": 1,
  "resolution": {
    "base": [
      16,
      16
    ]
  },
  "silhouettes": {
    "minimum_separation": "one_pixel"
  },
  "style": {
    "palette": [
      "#203040",
      "#6080a0"
    ]
  },
  "target_hash": "907702e4a434b0b3e4bd9f04237d19cbef3b0e84630ad65d2c88b02e2e95ca88",
  "target_id": "neutral_3d",
  "ui": {
    "minimum_text_px": 12
  },
  "vfx": {
    "photosensitivity": "safe"
  },
  "world_content_hash": "f87191f68b5a519006772748f3f6cbe3f2115a4cf2d4cc339c9a36821b384c70",
  "world_id": "foundation_slice"
}
